{
  "version": "0.1.0",
  "date": "2025-09-12",
  "changes": [
    { "type": "feat", "scope": "contracts", "description": "Add v1 schemas and PS runner" },
    { "type": "docs", "description": "Document contract test command" }
  ],
  "breaking_changes": [],
  "acknowledgements": ["GPT-5", "Han"]
}
